{
  "apiVersion": "helm-expt.confighub.com/v1alpha1",
  "kind": "ObservationReceipt",
  "metadata": {
    "name": "grafana-generated-passwords-local-kind"
  },
  "spec": {
    "variantRevision": "recipes/grafana/grafana/10.5.15/revisions/generated-passwords/r001/variant-revision.yaml",
    "renderedObjectSetSHA256": "893351c9b8cad0a10b0176a946bf514a76c5895bdb2d88a31bdd53a94288066d",
    "observer": {
      "name": "top20-local-e2e",
      "version": "0.2.0",
      "method": "kubectl-kind"
    },
    "target": {
      "kind": "kind",
      "name": "helm-expt-live-tail",
      "context": "kind-helm-expt-live-tail",
      "namespace": "grafana"
    },
    "observedAt": "2026-05-28T08:26:32.429Z",
    "freshnessTTL": "1h",
    "result": "pass",
    "chart": "grafana/grafana",
    "chartVersion": "10.5.15",
    "rank": 15,
    "variant": "generated-passwords",
    "renderedObjectCount": 9,
    "checks": [
      {
        "name": "server-side-apply",
        "result": "pass",
        "evidencePath": "kubectl-apply.txt",
        "evidenceSHA256": "e7653651d0ee5ca427e3bd36e51c9ed643de1e41cc01d2ba22747fa04b13cb48"
      },
      {
        "name": "deployment-grafana-rollout",
        "result": "pass",
        "object": "deployment/grafana",
        "evidencePath": "deployment-grafana-rollout.txt",
        "evidenceSHA256": "1fcaec89a7336ae8fcb51526819b121fa51b92b6ca45c8995897a47d9cfc5134"
      }
    ],
    "kubectlObjects": {
      "path": "kubectl-objects.txt",
      "sha256": "d0b8329c526bbb7d185bfae10ce0391fb8f9b77924732c6596b3f2db5570bf1a"
    }
  }
}
